key,item_id,rarity,name,category,image_num,color,brand,type,like,outfit_id,series_name,collection_term
sh_01,SH-01,SR,ギンガムハートサンレッドトップス,トップス,70019,赤,スイートハニー,ラブリー,700,sh_01,ブランドランク,
sh_02,SH-02,SR,ギンガムハートサンレッドスカート,ボトムス,70020,赤,スイートハニー,ラブリー,600,sh_01,ブランドランク,
sh_03,SH-03,SR,ギンガムハートサンレッドシューズ,シューズ,70021,赤,スイートハニー,ラブリー,650,sh_01,ブランドランク,
sh_04,SH-04,SR,ギンガムハートサンレッドヘアアクセ,ヘアアクセ,70022,赤,スイートハニー,ラブリー,600,sh_01,ブランドランク,
sh_05,SH-05,SR,アイスクリームグレープワンピ,ワンピース,27980,紫,スイートハニー,ラブリー,1200,sh_02,ブランドランク,
sh_06,SH-06,SR,アイスクリームグレープシューズ,シューズ,27981,紫,スイートハニー,ラブリー,600,sh_02,ブランドランク,
sh_07,SH-07,SR,アイスクリームグレープヘアアクセ,ヘアアクセ,27982,紫,スイートハニー,ラブリー,600,sh_02,ブランドランク,
sh_08,SH-08,SR,ミントギンガムサマーワンピ,ワンピース,70335,緑,スイートハニー,ラブリー,700,sh_03,ブランドランク,
sh_09,SH-09,SR,ミントギンガムサマーシューズ,シューズ,70336,緑,スイートハニー,ラブリー,650,sh_03,ブランドランク,
sh_10,SH-10,SR,ミントギンガムむぎわらハット,ヘアアクセ,70337,緑,スイートハニー,ラブリー,600,sh_03,ブランドランク,
sh_11,SH-11,SR,さくらひめさんごトップス,トップス,71107,オレンジ,スイートハニー,ラブリー,750,sh_04,ブランドランク,
sh_12,SH-12,SR,さくらひめさんごスカート,ボトムス,71108,オレンジ,スイートハニー,ラブリー,700,sh_04,ブランドランク,
sh_13,SH-13,SR,さくらひめさんごシューズ,シューズ,71109,オレンジ,スイートハニー,ラブリー,650,sh_04,ブランドランク,
sh_14,SH-14,SR,さくらひめさんごヘアアクセ,ヘアアクセ,71110,オレンジ,スイートハニー,ラブリー,650,sh_04,ブランドランク,
gy_01,GY-01,SR,バルーンブルーデニムサロペット,ワンピース,70069,青,ガールズエール,ポップ,1200,gy_01,ブランドランク,
gy_02,GY-02,SR,バルーンブルーデニムシューズ,シューズ,70070,ピンク,ガールズエール,ポップ,600,gy_01,ブランドランク,
gy_03,GY-03,SR,バルーンブルーデニムヘアアクセ,ヘアアクセ,70071,ピンク,ガールズエール,ポップ,600,gy_01,ブランドランク,
gy_04,GY-04,SR,ポップコーンショップグリーントップス,トップス,28012,緑,ガールズエール,ポップ,650,gy_02,ブランドランク,
gy_05,GY-05,SR,ポップコーンショップグリーンパンツ,ボトムス,28013,緑,ガールズエール,ポップ,600,gy_02,ブランドランク,
gy_06,GY-06,SR,ポップコーンショップグリーンシューズ,シューズ,28014,緑,ガールズエール,ポップ,700,gy_02,ブランドランク,
gy_07,GY-07,SR,ポップコーンショップグリーンヘアアクセ,ヘアアクセ,28015,緑,ガールズエール,ポップ,600,gy_02,ブランドランク,
gy_08,GY-08,SR,ストライプスターライトブルートップス,トップス,70338,青,ガールズエール,ポップ,700,gy_03,ブランドランク,
gy_09,GY-09,SR,ストライプスターライトブルースカート,ボトムス,70339,青,ガールズエール,ポップ,650,gy_03,ブランドランク,
gy_10,GY-10,SR,ストライプスターライトブルーシューズ,シューズ,70340,青,ガールズエール,ポップ,600,gy_03,ブランドランク,
gy_11,GY-11,SR,ストライプスターライトブルーヘアアクセ,ヘアアクセ,70341,青,ガールズエール,ポップ,600,gy_03,ブランドランク,
dw_01,DW-01,SR,セーラーマリンパステルピンクトップス,トップス,70166,ピンク,ドーリーワルツ,ラブリー,700,dw_01,ブランドランク,
dw_02,DW-02,SR,セーラーマリンパステルピンクスカート,ボトムス,70167,ピンク,ドーリーワルツ,ラブリー,650,dw_01,ブランドランク,
dw_03,DW-03,SR,セーラーマリンパステルピンクシューズ,シューズ,70168,ピンク,ドーリーワルツ,ラブリー,600,dw_01,ブランドランク,
dw_04,DW-04,SR,セーラーマリンパステルピンクヘアアクセ,ヘアアクセ,70186,ピンク,ドーリーワルツ,ラブリー,600,dw_01,ブランドランク,
dw_05,DW-05,SR,ピクニックギンガムブルーケープワンピ,ワンピース,70169,青,ドーリーワルツ,ラブリー,1200,dw_02,ブランドランク,
dw_06,DW-06,SR,ピクニックギンガムブルーシューズ,シューズ,70170,青,ドーリーワルツ,ラブリー,600,dw_02,ブランドランク,
dw_07,DW-07,SR,ピクニックギンガムブルーヘアアクセ,ヘアアクセ,70171,青,ドーリーワルツ,ラブリー,600,dw_02,ブランドランク,
dw_08,DW-08,SR,レトロストライプピンクトップス,トップス,70450,ピンク,ドーリーワルツ,ラブリー,600,dw_03,ブランドランク,
dw_09,DW-09,SR,レトロストライプピンクスカート,ボトムス,70451,ピンク,ドーリーワルツ,ラブリー,650,dw_03,ブランドランク,
dw_10,DW-10,SR,レトロストライプピンクシューズ,シューズ,70452,ピンク,ドーリーワルツ,ラブリー,700,dw_03,ブランドランク,
dw_11,DW-11,SR,レトロストライプピンクヘアアクセ,ヘアアクセ,70453,ピンク,ドーリーワルツ,ラブリー,600,dw_03,ブランドランク,
rb_01,RB-01,SR,スターダストレザーピンクトップス,トップス,70172,ピンク,ロマンスビート,クール,700,rb_01,ブランドランク,
rb_02,RB-02,SR,スターダストレザーピンクスカート,ボトムス,70173,ピンク,ロマンスビート,クール,600,rb_01,ブランドランク,
rb_03,RB-03,SR,スターダストレザーピンクブーツ,シューズ,70174,ピンク,ロマンスビート,クール,650,rb_01,ブランドランク,
rb_04,RB-04,SR,スターダストレザーピンクヘアアクセ,ヘアアクセ,70175,ピンク,ロマンスビート,クール,600,rb_01,ブランドランク,
rb_05,RB-05,SR,ミュージシャンイエロージャケット,トップス,70176,黄,ロマンスビート,クール,700,rb_02,ブランドランク,
rb_06,RB-06,SR,ミュージシャンイエローデニム,ボトムス,70177,黄,ロマンスビート,クール,600,rb_02,ブランドランク,
rb_07,RB-07,SR,ミュージシャンイエローシューズ,シューズ,70178,黄,ロマンスビート,クール,650,rb_02,ブランドランク,
rb_08,RB-08,SR,ミュージシャンイエローハット,ヘアアクセ,70179,黄,ロマンスビート,クール,600,rb_02,ブランドランク,
rb_09,RB-09,SR,ペイントパターンブルートップス,トップス,70391,青,ロマンスビート,クール,600,rb_03,ブランドランク,
rb_10,RB-10,SR,ペイントパターンブルースカート,ボトムス,70392,青,ロマンスビート,クール,650,rb_03,ブランドランク,
rb_11,RB-11,SR,ペイントパターンブルーシューズ,シューズ,70393,黒,ロマンスビート,クール,700,rb_03,ブランドランク,
rb_12,RB-12,SR,ペイントパターンブルーヘアアクセ,ヘアアクセ,70394,青,ロマンスビート,クール,600,rb_03,ブランドランク,
sa_01,SA-01,SR,ワイズガールインディゴトップス,トップス,70327,青,シークレットアリス,クール,700,sa_01,ブランドランク,
sa_02,SA-02,SR,ワイズガールインディゴスカート,ボトムス,70328,青,シークレットアリス,クール,650,sa_01,ブランドランク,
sa_03,SA-03,SR,ワイズガールインディゴシューズ,シューズ,70329,青,シークレットアリス,クール,600,sa_01,ブランドランク,
sa_04,SA-04,SR,ワイズガールインディゴヘアアクセ,ヘアアクセ,70330,青,シークレットアリス,クール,600,sa_01,ブランドランク,
sa_05,SA-05,SR,クラシックハートパープルトップス,トップス,70331,紫,シークレットアリス,クール,700,sa_02,ブランドランク,
sa_06,SA-06,SR,クラシックハートパープルスカート,ボトムス,70332,紫,シークレットアリス,クール,650,sa_02,ブランドランク,
sa_07,SA-07,SR,クラシックハートパープルシューズ,シューズ,70333,紫,シークレットアリス,クール,600,sa_02,ブランドランク,
sa_08,SA-08,SR,クラシックハートパープルヘアアクセ,ヘアアクセ,70334,紫,シークレットアリス,クール,600,sa_02,ブランドランク,
sa_09,SA-09,SR,クロックモダンパープルトップス,トップス,70606,紫,シークレットアリス,クール,700,sa_03,ブランドランク,
sa_10,SA-10,SR,クロックモダンパープルスカート,ボトムス,70607,紫,シークレットアリス,クール,650,sa_03,ブランドランク,
sa_11,SA-11,SR,クロックモダンパープルシューズ,シューズ,70608,紫,シークレットアリス,クール,600,sa_03,ブランドランク,
sa_12,SA-12,SR,クロックモダンパープルヘアアクセ,ヘアアクセ,70609,紫,シークレットアリス,クール,600,sa_03,ブランドランク,
sa_13,SA-13,SR,ロータスチャイナレッドブラウス,トップス,71287,赤,シークレットアリス,クール,750,sa_04,ブランドランク,
sa_14,SA-14,SR,ロータスチャイナレッドスカート,ボトムス,71288,赤,シークレットアリス,クール,700,sa_04,ブランドランク,
sa_15,SA-15,SR,ロータスチャイナレッドパンプス,シューズ,71289,赤,シークレットアリス,クール,650,sa_04,ブランドランク,
uq_01,UQ-01,SR,ねこうらないしフレッシュワンピ,ワンピース,70443,緑,ユニバースクイーン,クール,1200,uq_01,ブランドランク,
uq_02,UQ-02,SR,ねこうらないしフレッシュシューズ,シューズ,70444,緑,ユニバースクイーン,クール,600,uq_01,ブランドランク,
uq_03,UQ-03,SR,ねこうらないしフレッシュヘアアクセ,ヘアアクセ,70445,白,ユニバースクイーン,クール,600,uq_01,ブランドランク,
uq_04,UQ-04,SR,キラキラフィーバーピンクトップス,トップス,70439,ピンク,ユニバースクイーン,クール,700,uq_02,ブランドランク,
uq_05,UQ-05,SR,キラキラフィーバーピンクスカート,ボトムス,70440,ピンク,ユニバースクイーン,クール,650,uq_02,ブランドランク,
uq_06,UQ-06,SR,キラキラフィーバーピンクシューズ,シューズ,70441,ピンク,ユニバースクイーン,クール,600,uq_02,ブランドランク,
uq_07,UQ-07,SR,キラキラフィーバーピンクヘアアクセ,ヘアアクセ,70442,ピンク,ユニバースクイーン,クール,600,uq_02,ブランドランク,
uq_08,UQ-08,SR,ファンキーファーグリーントップス,トップス,70610,赤,ユニバースクイーン,クール,700,uq_03,ブランドランク,
uq_09,UQ-09,SR,ファンキーファーグリーンパンツ,ボトムス,70611,緑,ユニバースクイーン,クール,650,uq_03,ブランドランク,
uq_10,UQ-10,SR,ファンキーファーグリーンシューズ,シューズ,70612,緑,ユニバースクイーン,クール,600,uq_03,ブランドランク,
uq_11,UQ-11,SR,ファンキーファーグリーンヘアアクセ,ヘアアクセ,70613,緑,ユニバースクイーン,クール,600,uq_03,ブランドランク,
uq_12,UQ-12,SR,マジックレインどしゃぶりトップス,トップス,71291,青,ユニバースクイーン,クール,750,uq_04,ブランドランク,
uq_13,UQ-13,SR,マジックレインどしゃぶりパンツ,ボトムス,71292,青,ユニバースクイーン,クール,700,uq_04,ブランドランク,
uq_14,UQ-14,SR,マジックレインどしゃぶりシューズ,シューズ,71293,青,ユニバースクイーン,クール,650,uq_04,ブランドランク,
uq_15,UQ-15,SR,マジックレインどしゃぶりヘアアクセ,ヘアアクセ,71294,青,ユニバースクイーン,クール,650,uq_04,ブランドランク,
pm_01,PM-01,SR,エレガントパーティーイエロートップス,トップス,70598,黄,プレシャスミューズ,プレミアム,700,pm_01,ブランドランク,
pm_02,PM-02,SR,エレガントパーティーイエロースカート,ボトムス,70599,黄,プレシャスミューズ,プレミアム,650,pm_01,ブランドランク,
pm_03,PM-03,SR,エレガントパーティーイエローシューズ,シューズ,70600,黄,プレシャスミューズ,プレミアム,600,pm_01,ブランドランク,
pm_04,PM-04,SR,エレガントパーティーイエローヘアアクセ,ヘアアクセ,70601,黄,プレシャスミューズ,プレミアム,600,pm_01,ブランドランク,
pm_05,PM-05,SR,ドレッシーストライプブルートップス,トップス,70602,青,プレシャスミューズ,プレミアム,700,pm_02,ブランドランク,
pm_06,PM-06,SR,ドレッシーストライプブルースカート,ボトムス,70603,青,プレシャスミューズ,プレミアム,650,pm_02,ブランドランク,
pm_07,PM-07,SR,ドレッシーストライプブルーシューズ,シューズ,70604,青,プレシャスミューズ,プレミアム,600,pm_02,ブランドランク,
pm_08,PM-08,SR,ドレッシーストライプブルーヘアアクセ,ヘアアクセ,70605,青,プレシャスミューズ,プレミアム,600,pm_02,ブランドランク,
ch_01,CH-01,R,ゆるふわラブリーいちごワンピ,ワンピース,71100,ピンク,キューティーハピネス,ラブリー,1000,ch_01,ブランドランク,
ch_02,CH-02,R,ゆるふわラブリーいちごパンプス,シューズ,71101,ピンク,キューティーハピネス,ラブリー,500,ch_01,ブランドランク,
ch_03,CH-03,R,ゆるふわラブリーいちごヘアアクセ,ヘアアクセ,71102,ピンク,キューティーハピネス,ラブリー,500,ch_01,ブランドランク,
