item_id,rarity,name,category,image_num,color,brand,type,like,outfit_id,series_name,collection_term
SH-01,SR,ギンガムハートサンレッドトップス,トップス,70019,赤,スイートハニー,ラブリー,700,,ブランドランク,
SH-02,SR,ギンガムハートサンレッドスカート,ボトムス,70020,赤,スイートハニー,ラブリー,600,,ブランドランク,
SH-03,SR,ギンガムハートサンレッドシューズ,シューズ,70021,赤,スイートハニー,ラブリー,650,,ブランドランク,
SH-04,SR,ギンガムハートサンレッドヘアアクセ,ヘアアクセ,70022,赤,スイートハニー,ラブリー,600,,ブランドランク,
SH-05,SR,アイスクリームグレープワンピ,ワンピース,27980,紫,スイートハニー,ラブリー,1200,,ブランドランク,
SH-06,SR,アイスクリームグレープシューズ,シューズ,27981,紫,スイートハニー,ラブリー,600,,ブランドランク,
SH-07,SR,アイスクリームグレープヘアアクセ,ヘアアクセ,27982,紫,スイートハニー,ラブリー,600,,ブランドランク,
SH-08,SR,ミントギンガムサマーワンピ,ワンピース,70335,緑,スイートハニー,ラブリー,700,,ブランドランク,
SH-09,SR,ミントギンガムサマーシューズ,シューズ,70336,緑,スイートハニー,ラブリー,650,,ブランドランク,
SH-10,SR,ミントギンガムむぎわらハット,ヘアアクセ,70337,緑,スイートハニー,ラブリー,600,,ブランドランク,
SH-11,SR,さくらひめさんごトップス,トップス,71107,オレンジ,スイートハニー,ラブリー,750,J1-29,ブランドランク,
SH-12,SR,さくらひめさんごスカート,ボトムス,71108,オレンジ,スイートハニー,ラブリー,700,J1-29,ブランドランク,
SH-13,SR,さくらひめさんごシューズ,シューズ,71109,オレンジ,スイートハニー,ラブリー,650,J1-29,ブランドランク,
SH-14,SR,さくらひめさんごヘアアクセ,ヘアアクセ,71110,オレンジ,スイートハニー,ラブリー,650,J1-29,ブランドランク,
GY-01,SR,バルーンブルーデニムサロペット,ワンピース,70069,青,ガールズエール,ポップ,1200,,ブランドランク,
GY-02,SR,バルーンブルーデニムシューズ,シューズ,70070,ピンク,ガールズエール,ポップ,600,,ブランドランク,
GY-03,SR,バルーンブルーデニムヘアアクセ,ヘアアクセ,70071,ピンク,ガールズエール,ポップ,600,,ブランドランク,
GY-04,SR,ポップコーンショップグリーントップス,トップス,28012,緑,ガールズエール,ポップ,650,,ブランドランク,
GY-05,SR,ポップコーンショップグリーンパンツ,ボトムス,28013,緑,ガールズエール,ポップ,600,,ブランドランク,
GY-06,SR,ポップコーンショップグリーンシューズ,シューズ,28014,緑,ガールズエール,ポップ,700,,ブランドランク,
GY-07,SR,ポップコーンショップグリーンヘアアクセ,ヘアアクセ,28015,緑,ガールズエール,ポップ,600,,ブランドランク,
GY-08,SR,ストライプスターライトブルートップス,トップス,70338,青,ガールズエール,ポップ,700,,ブランドランク,
GY-09,SR,ストライプスターライトブルースカート,ボトムス,70339,青,ガールズエール,ポップ,650,,ブランドランク,
GY-10,SR,ストライプスターライトブルーシューズ,シューズ,70340,青,ガールズエール,ポップ,600,,ブランドランク,
GY-11,SR,ストライプスターライトブルーヘアアクセ,ヘアアクセ,70341,青,ガールズエール,ポップ,600,,ブランドランク,
DW-01,SR,セーラーマリンパステルピンクトップス,トップス,70166,ピンク,ドーリーワルツ,ラブリー,700,,ブランドランク,
DW-02,SR,セーラーマリンパステルピンクスカート,ボトムス,70167,ピンク,ドーリーワルツ,ラブリー,650,,ブランドランク,
DW-03,SR,セーラーマリンパステルピンクシューズ,シューズ,70168,ピンク,ドーリーワルツ,ラブリー,600,,ブランドランク,
DW-04,SR,セーラーマリンパステルピンクヘアアクセ,ヘアアクセ,70186,ピンク,ドーリーワルツ,ラブリー,600,,ブランドランク,
DW-05,SR,ピクニックギンガムブルーケープワンピ,ワンピース,70169,青,ドーリーワルツ,ラブリー,1200,,ブランドランク,
DW-06,SR,ピクニックギンガムブルーシューズ,シューズ,70170,青,ドーリーワルツ,ラブリー,600,,ブランドランク,
DW-07,SR,ピクニックギンガムブルーヘアアクセ,ヘアアクセ,70171,青,ドーリーワルツ,ラブリー,600,,ブランドランク,
DW-08,SR,レトロストライプピンクトップス,トップス,70450,ピンク,ドーリーワルツ,ラブリー,600,,ブランドランク,
DW-09,SR,レトロストライプピンクスカート,ボトムス,70451,ピンク,ドーリーワルツ,ラブリー,650,,ブランドランク,
DW-10,SR,レトロストライプピンクシューズ,シューズ,70452,ピンク,ドーリーワルツ,ラブリー,700,,ブランドランク,
DW-11,SR,レトロストライプピンクヘアアクセ,ヘアアクセ,70453,ピンク,ドーリーワルツ,ラブリー,600,,ブランドランク,
RB-01,SR,スターダストレザーピンクトップス,トップス,70172,ピンク,ロマンスビート,クール,700,,ブランドランク,
RB-02,SR,スターダストレザーピンクスカート,ボトムス,70173,ピンク,ロマンスビート,クール,600,,ブランドランク,
RB-03,SR,スターダストレザーピンクブーツ,シューズ,70174,ピンク,ロマンスビート,クール,650,,ブランドランク,
RB-04,SR,スターダストレザーピンクヘアアクセ,ヘアアクセ,70175,ピンク,ロマンスビート,クール,600,,ブランドランク,
RB-05,SR,ミュージシャンイエロージャケット,トップス,70176,黄,ロマンスビート,クール,700,,ブランドランク,
RB-06,SR,ミュージシャンイエローデニム,ボトムス,70177,黄,ロマンスビート,クール,600,,ブランドランク,
RB-07,SR,ミュージシャンイエローシューズ,シューズ,70178,黄,ロマンスビート,クール,650,,ブランドランク,
RB-08,SR,ミュージシャンイエローハット,ヘアアクセ,70179,黄,ロマンスビート,クール,600,,ブランドランク,
RB-09,SR,ペイントパターンブルートップス,トップス,70391,青,ロマンスビート,クール,600,,ブランドランク,
RB-10,SR,ペイントパターンブルースカート,ボトムス,70392,青,ロマンスビート,クール,650,,ブランドランク,
RB-11,SR,ペイントパターンブルーシューズ,シューズ,70393,黒,ロマンスビート,クール,700,,ブランドランク,
RB-12,SR,ペイントパターンブルーヘアアクセ,ヘアアクセ,70394,青,ロマンスビート,クール,600,,ブランドランク,
SA-01,SR,ワイズガールインディゴトップス,トップス,70327,青,シークレットアリス,クール,700,,ブランドランク,
SA-02,SR,ワイズガールインディゴスカート,ボトムス,70328,青,シークレットアリス,クール,650,,ブランドランク,
SA-03,SR,ワイズガールインディゴシューズ,シューズ,70329,青,シークレットアリス,クール,600,,ブランドランク,
SA-04,SR,ワイズガールインディゴヘアアクセ,ヘアアクセ,70330,青,シークレットアリス,クール,600,,ブランドランク,
SA-05,SR,クラシックハートパープルトップス,トップス,70331,紫,シークレットアリス,クール,700,,ブランドランク,
SA-06,SR,クラシックハートパープルスカート,ボトムス,70332,紫,シークレットアリス,クール,650,,ブランドランク,
SA-07,SR,クラシックハートパープルシューズ,シューズ,70333,紫,シークレットアリス,クール,600,,ブランドランク,
SA-08,SR,クラシックハートパープルヘアアクセ,ヘアアクセ,70334,紫,シークレットアリス,クール,600,,ブランドランク,
SA-09,SR,クロックモダンパープルトップス,トップス,70606,紫,シークレットアリス,クール,700,,ブランドランク,
SA-10,SR,クロックモダンパープルスカート,ボトムス,70607,紫,シークレットアリス,クール,650,,ブランドランク,
SA-11,SR,クロックモダンパープルシューズ,シューズ,70608,紫,シークレットアリス,クール,600,,ブランドランク,
SA-12,SR,クロックモダンパープルヘアアクセ,ヘアアクセ,70609,紫,シークレットアリス,クール,600,,ブランドランク,
SA-13,SR,ロータスチャイナレッドブラウス,トップス,71287,赤,シークレットアリス,クール,750,J2-BR01,ブランドランク,
SA-14,SR,ロータスチャイナレッドスカート,ボトムス,71288,赤,シークレットアリス,クール,700,J2-BR01,ブランドランク,
SA-15,SR,ロータスチャイナレッドパンプス,シューズ,71289,赤,シークレットアリス,クール,650,J2-BR01,ブランドランク,
UQ-01,SR,ねこうらないしフレッシュワンピ,ワンピース,70443,緑,ユニバースクイーン,クール,1200,,ブランドランク,
UQ-02,SR,ねこうらないしフレッシュシューズ,シューズ,70444,緑,ユニバースクイーン,クール,600,,ブランドランク,
UQ-03,SR,ねこうらないしフレッシュヘアアクセ,ヘアアクセ,70445,白,ユニバースクイーン,クール,600,,ブランドランク,
UQ-04,SR,キラキラフィーバーピンクトップス,トップス,70439,ピンク,ユニバースクイーン,クール,700,,ブランドランク,
UQ-05,SR,キラキラフィーバーピンクスカート,ボトムス,70440,ピンク,ユニバースクイーン,クール,650,,ブランドランク,
UQ-06,SR,キラキラフィーバーピンクシューズ,シューズ,70441,ピンク,ユニバースクイーン,クール,600,,ブランドランク,
UQ-07,SR,キラキラフィーバーピンクヘアアクセ,ヘアアクセ,70442,ピンク,ユニバースクイーン,クール,600,,ブランドランク,
UQ-08,SR,ファンキーファーグリーントップス,トップス,70610,赤,ユニバースクイーン,クール,700,,ブランドランク,
UQ-09,SR,ファンキーファーグリーンパンツ,ボトムス,70611,緑,ユニバースクイーン,クール,650,,ブランドランク,
UQ-10,SR,ファンキーファーグリーンシューズ,シューズ,70612,緑,ユニバースクイーン,クール,600,,ブランドランク,
UQ-11,SR,ファンキーファーグリーンヘアアクセ,ヘアアクセ,70613,緑,ユニバースクイーン,クール,600,,ブランドランク,
UQ-12,SR,マジックレインどしゃぶりトップス,トップス,71291,青,ユニバースクイーン,クール,750,J2-BR02,ブランドランク,
UQ-13,SR,マジックレインどしゃぶりパンツ,ボトムス,71292,青,ユニバースクイーン,クール,700,J2-BR02,ブランドランク,
UQ-14,SR,マジックレインどしゃぶりシューズ,シューズ,71293,青,ユニバースクイーン,クール,650,J2-BR02,ブランドランク,
UQ-15,SR,マジックレインどしゃぶりヘアアクセ,ヘアアクセ,71294,青,ユニバースクイーン,クール,650,J2-BR02,ブランドランク,
PM-01,SR,エレガントパーティーイエロートップス,トップス,70598,黄,プレシャスミューズ,プレミアム,700,,ブランドランク,
PM-02,SR,エレガントパーティーイエロースカート,ボトムス,70599,黄,プレシャスミューズ,プレミアム,650,,ブランドランク,
PM-03,SR,エレガントパーティーイエローシューズ,シューズ,70600,黄,プレシャスミューズ,プレミアム,600,,ブランドランク,
PM-04,SR,エレガントパーティーイエローヘアアクセ,ヘアアクセ,70601,黄,プレシャスミューズ,プレミアム,600,,ブランドランク,
PM-05,SR,ドレッシーストライプブルートップス,トップス,70602,青,プレシャスミューズ,プレミアム,700,,ブランドランク,
PM-06,SR,ドレッシーストライプブルースカート,ボトムス,70603,青,プレシャスミューズ,プレミアム,650,,ブランドランク,
PM-07,SR,ドレッシーストライプブルーシューズ,シューズ,70604,青,プレシャスミューズ,プレミアム,600,,ブランドランク,
PM-08,SR,ドレッシーストライプブルーヘアアクセ,ヘアアクセ,70605,青,プレシャスミューズ,プレミアム,600,,ブランドランク,
CH-01,R,ゆるふわラブリーいちごワンピ,ワンピース,71100,ピンク,キューティーハピネス,ラブリー,1000,J1-28,ブランドランク,
CH-02,R,ゆるふわラブリーいちごパンプス,シューズ,71101,ピンク,キューティーハピネス,ラブリー,500,J1-28,ブランドランク,
CH-03,R,ゆるふわラブリーいちごヘアアクセ,ヘアアクセ,71102,ピンク,キューティーハピネス,ラブリー,500,J1-28,ブランドランク,
