series,prefecture,name,address
prichan,広島県,ふぇすたらんど府中,広島県安芸郡府中町大須４丁目２－１０サンリブ府中店内
prichan,広島県,アミパラフォレオ広島東,広島県広島市東区温品１丁目３－２フォレオ広島東１階
prichan,広島県,あみぱらんど福山,広島県福山市三吉町南２－８－２４
prichan,広島県,アミパラ広島,広島県広島市西区西観音町３－１７
prichan,広島県,アミューズメント１４１メリーゴーランド神辺,広島県福山市神辺町新湯野２－３０－４アクト神辺１階
prichan,広島県,イオン宇品,広島県広島市南区宇品東６－１－１５
prichan,広島県,イオン広島府中,広島県安芸郡府中町大須２－１－１玩具売場
prichan,広島県,モーリーファンタジー三原,広島県三原市城町２－１３－１イオン三原店２階
prichan,広島県,イオン三原,広島県三原市城町２－１３－１玩具売場
prichan,広島県,エディオン広島本店,広島県広島市中区紙屋町２－１－１８
prichan,広島県,セガワールド福山,広島県福山市瀬戸町大字山北300
prichan,広島県,セガ海田,広島県安芸郡海田町南大正町３－３５
prichan,広島県,タイトーＦステーションゆめタウンみゆき,広島県広島市南区宇品西６丁目７番１４号ゆめタウンみゆき２Ｆ
prichan,広島県,タイトーＦステーションゆめタウン東広島,広島県東広島市西条町土与丸1丁目5-7
prichan,広島県,タイトーステーションフジグラン神辺,広島県福山市神辺町大字新道上字２－１０－２６フジグラン神辺店３Ｆ
prichan,広島県,タイトーステーションフジグラン緑井,広島県広島市安佐南区緑井１－５－２フジグラン緑井３Ｆ
prichan,広島県,タイトーステーション広島紙屋町,広島県広島市中区紙屋町２丁目２－２１
prichan,広島県,タイトーステーション広島本通,広島県広島市中区本通３－５
prichan,広島県,トイザらスベビーザらス広島府中,広島県安芸郡府中町大須２－１－１　イオンモール広島府中３Ｆ
prichan,広島県,トイザらス福山,広島県福山市東深津町３－２１－４
prichan,広島県,ビックカメラ広島駅前,広島県広島市南区松原町5-1
prichan,広島県,ふぇすたらんど可部,広島県広島市安佐北区可部７丁目４－１３
prichan,広島県,ふぇすたらんど五日市,広島県広島市佐伯区八幡１－２４－１７　サンリブ五日市店内
prichan,広島県,フジグランナタリー,広島県廿日市市阿品３－１－１
prichan,広島県,フジグラン安芸,広島県安芸郡坂町北新地２丁目３－３０　玩具売場
prichan,広島県,フジグラン高陽,広島県広島市安佐北区亀崎一丁目１番６号　玩具売場
prichan,広島県,フジグラン三原,広島県三原市円一町１－１－７　玩具売場
prichan,広島県,フジグラン神辺,広島県福山市神辺町道上７５　玩具売場
prichan,広島県,フジグラン東広島,広島県東広島市西条町御薗宇４４０５　玩具売場
prichan,広島県,フジグラン尾道,広島県尾道市東尾道１９番地７
prichan,広島県,フジグラン緑井,広島県広島市安佐南区緑井１－５－２　玩具売場
prichan,広島県,プラサカプコン広島,広島県広島市佐伯区石内東４丁目１番１号ジアウトレット広島１Ｆ
prichan,広島県,ペリカン呉,広島県呉市宝町５－１０ゆめタウン呉内３Ｆ　玩具売場
prichan,広島県,ペリカン江田島,広島県江田島市大柿町飛渡瀬１８０
prichan,広島県,ペリカン大竹,広島県大竹市晴海１－６－１ゆめタウン大竹内２Ｆ　玩具売場
prichan,広島県,ペリカン東広島,広島県東広島市西条町土与丸１－５－７ゆめタウン東広島内４Ｆ
prichan,広島県,モーリーファンタジー・ｆ広島祇園,広島県広島市安佐南区祇園3丁目2-1　イオンＳＣ3F
prichan,広島県,モーリーファンタジー宇品,広島県広島市南区宇品東６－１－１５イオン２Ｆ
prichan,広島県,モーリーファンタジー広島祇園,広島県広島市安佐南区祇園3丁目２－１イオン３Ｆ
prichan,広島県,モーリーファンタジー広島府中,広島県安芸郡府中町大須２－１－１イオン２Ｆ
prichan,広島県,モーリーファンタジー広島祗園,広島県広島市安佐南区祇園３丁目２－１イオン3階
prichan,広島県,モーリーファンタジー三原,広島県三原市城町２－１３－１イオン２Ｆ
prichan,広島県,モーリーファンタジー尾道,広島県尾道市天満町１７－２３イオン２Ｆ
prichan,広島県,ヤマダ電機ＬＡＢＩ広島,広島県広島市中区胡町５－２２
prichan,広島県,ゆめタウン学園,広島県東広島市西条下見６丁目２－３２
prichan,広島県,ゆめタウン廿日市,広島県廿日市市下平良二丁目2-1
prichan,広島県,わいわい王国メリーゴーランド楽々園,広島県広島市佐伯区楽々園４丁目１４－１ナイスデイ２階
prichan,広島県,楽市楽座広島,広島県広島市南区段原南１－３－５２広島段原ショッピングセンター７階
prichan,広島県,娯楽座メリーゴーランド高陽,広島県広島市安佐北区口田４丁目６－３２マックスバリュ高陽店３階
prichan,広島県,福山メトロポリス,広島県福山市一文字町２４－１
