series,prefecture,name,address
prichan,千葉県,Ｆｏｒｋｉｄｓ’+ｂｂｙこぐま流山おおたかの森ＳＣ,千葉県流山市西初石６－１８５－２流山おおたかの森ＳＣ３Ｆ
prichan,千葉県,Ｆｏｒｋｉｄｓ’ｂｙこぐまボンベルタ成田,千葉県成田市赤坂２ー１ー１０ボンベルタ成田３ＦＦｏｒｋｉｄｓ'byこぐま成田店
prichan,千葉県,ＧＡＭＥＳＱＵＡＲＥ茂原,千葉県茂原市六ツ野八貫野２７８５－１　ライフガーデン茂原
prichan,千葉県,ＭＥＧＡドン・キホーテラパーク成東,千葉県山武市成東1808-1
prichan,千葉県,ＮＩＣＯＰＡ＆ｎｉｃｏｇｒｏｕｎｄ新浦安,千葉県浦安市明海４－１－１ニューコースト新浦安３Ｆ
prichan,千葉県,ＮＩＣＯＰＡアクロスモール新鎌ヶ谷,千葉県鎌ケ谷市新鎌ヶ谷２－１２－１　アクロスモール新鎌ヶ谷２Ｆ
prichan,千葉県,ＮＩＣＯＰＡイオンタウン成田富里,千葉県成田市東町133番地　イオンタウン成田富里店２Ｆ
prichan,千葉県,ＮＩＣＯＰＡマリンピア,千葉県千葉市美浜区高洲３－１３－１マリンピア４階
prichan,千葉県,ＳＯＹＵ　ＧａｍｅＦｉｅｌｄ木更津店,千葉県木更津市築地１番４イオンモール木更津２Ｆ
prichan,千葉県,ＹＡＺワールド野田七光台,千葉県野田市七光台４－２
prichan,千葉県,アピタ君津,千葉県君津市久保1-1-1
prichan,千葉県,アピタ木更津,千葉県木更津市ほたる野4-2-48
prichan,千葉県,MEGAドンキホーテ市原,千葉県市原市青柳北１－１
prichan,千葉県,アピナ市原,千葉県市原市更級４－２－１　アクロスプラザ市原更級F棟１階
prichan,千葉県,アミュージアム稲毛,千葉県千葉市稲毛区小仲台１－４－２０イオン稲毛２Ｆ
prichan,千葉県,アミュージアム茂原,千葉県茂原市高師1619-1
prichan,千葉県,アミューズメントＰＬＡＢＩモラージュ柏,千葉県柏市大山台２丁目３番地モラージュ柏２Ｆ
prichan,千葉県,アミューズメントエース市川,千葉県市川市市川1-9-11　サン市川ハイツ１Ｆ
prichan,千葉県,イオンキッズ津田沼,千葉県習志野市津田沼１－２３－１玩具売場
prichan,千葉県,イオンユーカリが丘,千葉県佐倉市西ユーカリが丘6丁目12番地の3
prichan,千葉県,イオン稲毛,千葉県千葉市稲毛区小仲台１－４－２０玩具売場
prichan,千葉県,イオン臼井,千葉県佐倉市王子台１－２３玩具売場
prichan,千葉県,イオン鎌ケ谷,千葉県鎌ケ谷市新鎌ケ谷２－７－１　イオン玩具売場２Ｆ
prichan,千葉県,イオン鎌取,千葉県千葉市緑区おゆみ野３－１６－１玩具売場
prichan,千葉県,イオン館山,千葉県館山市八幡５４５－１玩具売場
prichan,千葉県,イオン高根木戸,千葉県船橋市習志野台１－１－３
prichan,千葉県,イオン市川妙典,千葉県市川市妙典５－３－１玩具売場
prichan,千葉県,イオン新浦安,千葉県浦安市入船１－４－１　玩具売場
prichan,千葉県,イオン成田,千葉県成田市ウイング土屋２４番地　イオン２Ｆ玩具売場
prichan,千葉県,イオン千葉ニュータウン,千葉県印西市中央北３－１－１玩具売場
prichan,千葉県,プレビジョイフル本田千葉ニュータウン,千葉県印西市牧の原２－１ジョイフル本田千葉ニュータウン店２階
prichan,千葉県,イオン船橋,千葉県船橋市山手１－１－８玩具売場
prichan,千葉県,イオン銚子,千葉県銚子市三崎町２－２６６０－１玩具売場
prichan,千葉県,イオン幕張,千葉県千葉市美浜区ひび野１－３玩具売場
prichan,千葉県,イトーヨーカドーアリオ市原,千葉県市原市更級４-３-２
prichan,千葉県,イトーヨーカドーアリオ蘇我,千葉県千葉市中央区川崎町５２－７玩具売場
prichan,千葉県,イトーヨーカドーアリオ柏,千葉県柏市大島田950-1
prichan,千葉県,イトーヨーカドー我孫子,千葉県我孫子市我孫子４－１１－１玩具売場
prichan,千葉県,イトーヨーカドー四街道,千葉県四街道市中央５番地玩具売場
prichan,千葉県,イトーヨーカドー姉崎,千葉県市原市姉崎６４５－１玩具売場
prichan,千葉県,イトーヨーカドー松戸,千葉県松戸市松戸１１４９玩具売場
prichan,千葉県,イトーヨーカドー船橋,千葉県船橋市本町７－６－１玩具売場
prichan,千葉県,イトーヨーカドー津田沼,千葉県習志野市津田沼１－１０－３０玩具売場
prichan,千葉県,イトーヨーカドー八千代,千葉県八千代市村上南１－３－１玩具売場
prichan,千葉県,イトーヨーカドー八柱,千葉県松戸市日暮１－１５－８玩具売場
prichan,千葉県,イトーヨーカドー幕張,千葉県千葉市花見川区幕張町４－４１７－２５玩具売場
prichan,千葉県,イトーヨーカドー流山,千葉県流山市流山９－８００－２玩具売場
prichan,千葉県,カインズホーム旭飯岡,千葉県旭市三川字犬林セの４３３４－１
prichan,千葉県,カインズホーム八日市場,千葉県匝瑳市八日市場口字横田１１８
prichan,千葉県,キャッツアイ八千代,千葉県八千代市吉橋１８５１番地ｉｓｍ緑が丘内
prichan,千葉県,キラキラＡｓｏｂｏｘフルル八千代,千葉県八千代市村上南１－４－１フルルガーデン八千代２Ｆ
prichan,千葉県,ゲームファンタジア美浜,千葉県千葉市美浜新港３２－６－１（１号棟-２）
prichan,千葉県,ゲームランドちはら台,千葉県市原市ちはら台西３－４ショッピングモールｕｎｉｍｏちはら台２Ｆ
prichan,千葉県,ゲームランド千葉ニュータウン,千葉県印西市中央北３－２ イオンモール千葉ニュータウンモールシネマスポーツ棟2F
prichan,千葉県,ゲームランド津田沼,千葉県習志野市津田沼１－２３－１イオンモール内
prichan,千葉県,こころっこ姉崎,千葉県市原市姉崎６４５－１イトーヨーカドー姉崎店内３階
prichan,千葉県,スーパービバホーム新習志野２階ゲームコーナー,千葉県習志野市茜浜１－１－２スーパービバホーム新習志野店２Ｆゲームコーナー
prichan,千葉県,スコナランド酒々井,千葉県印旛郡酒々井町本佐倉４５７－２
prichan,千葉県,セガアリーナ蘇我,千葉県千葉市中央区川崎町５１－１ハーバーシティ蘇我フェスティバルウォークアミューズメント棟１Ｆ
prichan,千葉県,セガイオンモール銚子,千葉県銚子市三崎町２丁目２６６０－１　イオンモール銚子　２Ｆ
prichan,千葉県,セガららぽーとＴＯＫＹＯ－ＢＡＹ,千葉県船橋市浜町２－１－１北館１階Ｅ１２２区画
prichan,千葉県,セガ我孫子,千葉県我孫子市柴崎字天王台　４７－１
prichan,千葉県,セガ松戸,千葉県松戸市日暮1-1-1 八柱駅第2ビル2階
prichan,千葉県,セガ幕張,千葉県千葉市美浜区ひび野１－８　メッセ・アミューズ・モール１階
prichan,千葉県,そごう千葉本館６階玩具売場,千葉県千葉市中央区新町１０００そごう千葉店本館６Ｆ玩具売場
prichan,千葉県,ソユープレイランドソピア幕張,千葉県千葉市花見川区幕張町四丁目４１７－２５イトーヨーカドー幕張店２Ｆ
prichan,千葉県,ダイエー市川コルトンプラザ,千葉県市川市鬼高　１－１－１
prichan,千葉県,タイトーＦステーションダイエー新松戸,千葉県松戸市新松戸3-2-21
prichan,千葉県,タイトーＦステーションボンベルタ成田,千葉県成田市赤坂２－１－１０ボンベルタ成田３Ｆ
prichan,千葉県,タイトーＦステーション市川妙典,千葉県市川市妙典４丁目１番１号イオン市川妙典店２番街２階
prichan,千葉県,タイトーＦステーション柏中央,千葉県柏市十余ニ２４９－５ＭＥＭ内
prichan,千葉県,タイトーFステーション柏中央,千葉県柏市十余ニ249-5　MEM内
prichan,千葉県,タイトーステーションアリオ蘇我,千葉県千葉市中央区川崎町５２－７アリオ蘇我２Ｆ
prichan,千葉県,タイトーステーションセブンパークアリオ柏２号,千葉県柏市大島田９５０－１
prichan,千葉県,タイトーステーション旭サンモール,千葉県旭市イ－２６７６－１サンモール３Ｆ
prichan,千葉県,タイトーステーション船橋,千葉県船橋市本町１丁目６－１
prichan,千葉県,タイトーステーション柏,千葉県柏市柏２－３－１
prichan,千葉県,タイトーステーション茂原アスモ,千葉県茂原市高師１７３５茂原ショッピングプラザアスモ２Ｆ
prichan,千葉県,テクモピアロックダム公津の杜,千葉県成田市公津の杜４－５－３成田ユアエルム３Ｆ
prichan,千葉県,トイザらス市川,千葉県市川市鬼高１－１－１　ニッケコルトンプラザイースト館２Ｆ
prichan,千葉県,トイザらス松戸,千葉県松戸市二ツ木１７８１－２　プチモール二ツ木２Ｆ
prichan,千葉県,トムソーヤの仲間たちアリオ市原,千葉県市原市更級４－３－２アリオ内２階
prichan,千葉県,パラボランド東金,千葉県東金市東岩崎８－１０サンピア３Ｆ
prichan,千葉県,パレパレ稲毛長沼,千葉県千葉市稲毛区長沼原町７３１－１７
prichan,千葉県,ハローズガーデン市原,千葉県市原市青柳北１－１アピタ市原店２階
prichan,千葉県,ハローズガーデン木更津,千葉県木更津市ほたる野４－２－４８アピタ木更津店２Ｆ
prichan,千葉県,ハロータイトー流山,千葉県流山市流山市９丁目８００２号イトーヨーカドー流山店３Ｆ
prichan,千葉県,ビックカメラ柏,千葉県柏市柏市１－１－２０スカイプラザ柏
prichan,千葉県,プラサカプコン成田,千葉県成田市ウイング土屋２４イオンモール成田２Ｆ
prichan,千葉県,プラサカプコン富津,千葉県富津市青木一丁目５番地１　イオンモール富津２Ｆ
prichan,千葉県,プレビキテミテマツド,千葉県松戸市松戸１３０７－１キテミテマツド店内６Ｆ南ＡＳＯＢＩ諸島
prichan,千葉県,プレビミスターマックス千葉美浜,千葉県千葉市美浜区新港３２番１１号ミスターマックス千葉美浜店内
prichan,千葉県,プレビ南ＡＳＯＢＩ諸島ワンズモール,千葉県稲毛区長沼町３３０番地５０ワンズモール２Ｆ
prichan,千葉県,ボウルアピア柏中央,千葉県柏市十余二249-5　MEM内
prichan,千葉県,ホビーステーション津田沼,千葉県習志野市津田沼１－２－２２小倉ビル３Ｆ
prichan,千葉県,マリンガーデンららぽーと船橋,千葉県船橋市浜町２丁目１番１号ららぽーとＴＯＫＹＯ－ＢＡＹ　西館３階
prichan,千葉県,ミスターマックスおゆみの,千葉県千葉市おゆみ野中央２－３－１
prichan,千葉県,メルヘンランドアメリー大網,千葉県山武郡大網白里町みやこ野１－１－１大網白里アメリー３階
prichan,千葉県,モーリーファンタジーあすみが丘,千葉県千葉市緑区あすみが丘７丁目１あすみが丘ブランニューモール２Ｆ
prichan,千葉県,モーリーファンタジーおゆみ野,千葉県千葉市緑区おゆみ野南５丁目３７－１イオンタウン２Ｆ
prichan,千葉県,モーリーファンタジーノア,千葉県野田市中根３６－１イオン１Ｆ
prichan,千葉県,モーリーファンタジーユーカリが丘,千葉県佐倉市西ユーカリが丘6丁目12番地の3
prichan,千葉県,モーリーファンタジー鎌ヶ谷,千葉県鎌ヶ谷市新鎌ヶ谷２丁目７番１号イオン２Ｆ
prichan,千葉県,モーリーファンタジー鎌取,千葉県千葉市緑区おゆみ野３丁目１６番地イオン４Ｆ
prichan,千葉県,モーリーファンタジー館山,千葉県館山市八幡５４５－１イオン１Ｆ
prichan,千葉県,モーリーファンタジー五香,千葉県松戸市五香８－４４－６オウル五香１Ｆ
prichan,千葉県,モーリーファンタジー市川妙典,千葉県市川市妙典５－３－１イオン３Ｆ
prichan,千葉県,モーリーファンタジー新松戸,千葉県松戸市新松戸３－２－２
prichan,千葉県,モーリーファンタジー成田,千葉県成田市ウイング土屋２４番地イオン２Ｆ
prichan,千葉県,モーリーファンタジー千葉ニュ－タウン,千葉県印西市中央北３丁目１番１イオン３Ｆ
prichan,千葉県,モーリーファンタジー千葉長沼,千葉県千葉市稲毛区長沼町３３０－５０ダイエー千葉長沼店１Ｆ
prichan,千葉県,モーリーファンタジー船橋,千葉県船橋市山手１丁目１番地８号イオン３Ｆ
prichan,千葉県,モーリーファンタジー銚子,千葉県銚子市三崎町２丁目２６６０－１イオン２Ｆ
prichan,千葉県,モーリーファンタジー長浦,千葉県袖ヶ浦市長浦駅前１－７
prichan,千葉県,モーリーファンタジー津田沼,千葉県習志野市津田沼１丁目２３番１号イオン３Ｆ
prichan,千葉県,モーリーファンタジー東習志野,千葉県習志野市東習志野６丁目７－８イオンタウン１Ｆ
prichan,千葉県,モーリーファンタジー南行徳,千葉県市川市南行徳２－２０－２５
prichan,千葉県,モーリーファンタジー柏,千葉県柏市豊町２丁目５番２５号イオン２Ｆ
prichan,千葉県,モーリーファンタジー八街,千葉県八街市文違３０１イオン１Ｆ
prichan,千葉県,モーリーファンタジー八千代緑が丘,千葉県八千代市緑が丘２丁目１－３イオン４Ｆ
prichan,千葉県,モーリーファンタジー幕張新都心,千葉県千葉市美浜区豊砂１－５イオンモール（ファミリーモール）２Ｆ
prichan,千葉県,モーリーファンタジー木更津,千葉県木更津市築地１－４　イオン２Ｆ
prichan,千葉県,ヤマダ電機ＬＡＢＩ津田沼,千葉県習志野市谷津　１－１６－１モリシア津田沼３Ｆ
prichan,千葉県,ヨドバシカメラマルチメディア千葉,千葉県千葉市中央区富士見２－３－１
prichan,千葉県,ラウンドワンアリオ柏,千葉県柏市大島田１丁目６番地１
prichan,千葉県,レジャーランド野田,千葉県野田市吉春776-1
prichan,千葉県,レジャーレンド成東,千葉県山武市姫島１１１－１
prichan,千葉県,西友行徳,千葉県市川市行徳駅前１－１９－１
prichan,千葉県,宝島ららぽーと柏の葉,千葉県柏市若柴１７５
prichan,千葉県,宝島四街道,千葉県四街道市めいわ２－１－１ＭＥＧＡドン・キホーテ２Ｆ
prichan,千葉県,宝島新浦安,千葉県浦安市入船１－４－１イオン新浦安店４Ｆ
prichan,千葉県,宝島北小金,千葉県松戸市小金１番地　イオン５階
prichan,千葉県,野田ホビーノア,千葉県野田市中根３６ショッピングセンターノア３Ｆ
