series,prefecture,name,address
prichan,愛知県,ＧＡＺＡ３Ｆゲームコーナー,愛知県豊田市喜多町１丁目１４０番地
prichan,愛知県,ＭＥＧＡドン・キホーテＵＮＹ国府,愛知県豊川市国府町桜田１０３
prichan,愛知県,ＭＥＧＡドン・キホーテＵＮＹ小牧,愛知県小牧市堀の内３丁目 15番地
prichan,愛知県,ＭＥＧＡドン・キホーテＵＮＹ太田川,愛知県東海市大田町下浜田１０２-１　玩具売場
prichan,愛知県,ＭＥＧＡドン・キホーテＵＮＹ東海通,愛知県名古屋市港区港明１丁目１０番２８号玩具売場
prichan,愛知県,ＭＥＧＡドン・キホーテＵＮＹ桃花台,愛知県小牧市古雅一丁目１番地　玩具売場
prichan,愛知県,ＭＥＧＡドン・キホーテＵＮＹ豊田元町,愛知県豊田市土橋町２丁目６５番地　玩具売場
prichan,愛知県,ＭＥＧＡドン・キホーテ豊橋,愛知県豊橋市藤沢町１４１
prichan,愛知県,ＮＩＣＯＰＡアピタ新守山,愛知県名古屋市守山区新守山２８３０アピタ新守山２Ｆ
prichan,愛知県,ＮＩＣＯＰＡウイングタウン岡崎,愛知県岡崎市羽根町小豆坂３番地
prichan,愛知県,ＮＩＣＯＰＡなるぱーく,愛知県名古屋市緑区浦里三丁目２３２　なるぱーく２Ｆ
prichan,愛知県,ＮＩＣＯＰＡ岡崎,愛知県岡崎市上和田町南天白５１エルエルタウン岡崎店２階
prichan,愛知県,ＰＩＣＯ尾西,愛知県一宮市小信中島東鵯平５９番地ピアゴ尾西２Ｆ
prichan,愛知県,アピタ阿久比,愛知県知多郡阿久比町椋岡徳吉１番地１２　玩具売場
prichan,愛知県,アピタ安城南,愛知県安城市桜井町貝戸尻６０番地　玩具売場
prichan,愛知県,アピタ一宮,愛知県一宮市両郷町１丁目６番地　玩具売場
prichan,愛知県,アピタ稲沢,愛知県稲沢市天池五反田町１番地
prichan,愛知県,アピタ岡崎北,愛知県岡崎市日名北町4-46
prichan,愛知県,アピタ蒲郡,愛知県蒲郡市港町１７番１０号　玩具売場
prichan,愛知県,アピタ刈谷,愛知県刈谷市南桜町2丁目56番1号
prichan,愛知県,アピタ岩倉,愛知県岩倉市旭町1丁目25番地
prichan,愛知県,アピタ向山,愛知県豊橋市向山町字中畑1番地1
prichan,愛知県,アピタ江南西,愛知県江南市松竹町上野２０５番地
prichan,愛知県,アピタ港,愛知県名古屋市港区当知二丁目1501番地　玩具売場
prichan,愛知県,アピタ高蔵寺,愛知県春日井市中央台２丁目５番地　玩具売場
prichan,愛知県,アピタ瀬戸,愛知県瀬戸市幸町３３番地　玩具売場
prichan,愛知県,アピタ西尾,愛知県西尾市高畠町３丁目２３－９　玩具売場
prichan,愛知県,アピタ千代田橋,愛知県名古屋市千種区千代田橋2丁目1番1号
prichan,愛知県,アピタ大口,愛知県丹羽郡大口町丸２丁目３６番地　玩具売場
prichan,愛知県,アピタ大府,愛知県大府市明成町４丁目１３３番地　玩具売場
prichan,愛知県,アピタ知立,愛知県知立市長篠町大山１８番地の１　玩具売場
prichan,愛知県,アピタ長久手,愛知県長久手市戸田谷９０１番地１　玩具売場
prichan,愛知県,アピタ東海荒尾,愛知県東海市荒尾町山王前２０番地玩具売場
prichan,愛知県,アピタ名古屋空港,愛知県西春日井郡豊山町大字豊場字林先１番８　玩具売場
prichan,愛知県,アピタ名古屋南,愛知県名古屋市南区豊田四丁目９番４７号
prichan,愛知県,アピタ名北,愛知県名古屋市北区辻町９丁目１番地　玩具売場
prichan,愛知県,アピタ鳴海,愛知県名古屋市緑区鳴海町伝治山３番地９　玩具売場
prichan,愛知県,アピタ木曽川,愛知県一宮市木曽川町黒田八ノ通51番地の4
prichan,愛知県,アピタ緑,愛知県名古屋市緑区徳重二丁目２０１番地　玩具売場
prichan,愛知県,アミュージアム津島,愛知県津島市大字津島北新開３５１番地　ヨシズヤ津島本店　別館２階
prichan,愛知県,アミューズファクトリー常滑,愛知県常滑市りんくう町２丁目２０番３イオンモール常滑店２F
prichan,愛知県,イオンナゴヤドーム前,愛知県名古屋市東区矢田南４－１０２－３玩具売場
prichan,愛知県,イオンワンダーシティ,愛知県名古屋市西区二方町４０玩具売場
prichan,愛知県,イオン岡崎南,愛知県岡崎市戸崎町字ばら山１－１玩具売場
prichan,愛知県,イオン高橋,愛知県豊田市東山町１－５－１玩具売場
prichan,愛知県,イオン三好,愛知県みよし市三好町青木９１玩具売場
prichan,愛知県,イオン小牧,愛知県小牧市東１－１２６玩具売場
prichan,愛知県,イオン上飯田,愛知県名古屋市北区織部町１玩具売場
prichan,愛知県,イオン大高,愛知県名古屋市緑区大高町字奥平子１－１玩具売場
prichan,愛知県,イオン東浦,愛知県知多郡東浦町大字緒川字申新田二区６７－８玩具売場
prichan,愛知県,イオン熱田,愛知県名古屋市熱田区六野１－２－１１玩具売場
prichan,愛知県,イオン扶桑,愛知県丹羽郡扶桑町大字南山名字高塚５－１玩具売場
prichan,愛知県,イオン豊橋南,愛知県豊橋市野依町字落合１－１２玩具売場
prichan,愛知県,イオン名古屋みなと,愛知県名古屋市港区品川町２－１－６玩具売場
prichan,愛知県,イオン木曽川,愛知県一宮市木曽川町黒田字南八ツケ池２５－１玩具売場
prichan,愛知県,イトーヨーカドー安城,愛知県安城市住吉町３－１－８玩具売場
prichan,愛知県,イトーヨーカドー刈谷,愛知県刈谷市高倉町２６０１
prichan,愛知県,イトーヨーカドー知多,愛知県知多市新知東町１－１０－１玩具売場
prichan,愛知県,イトーヨーカドー尾張旭,愛知県尾張旭市南原山町石原１１６－４玩具売場
prichan,愛知県,エディオン名古屋本店,愛知県名古屋市中村区名駅南２－４－２２
prichan,愛知県,カーニバル・Ｃドーム,愛知県西尾市上町南又七山３５番２
prichan,愛知県,カラフルパークイオン千種,愛知県名古屋市千種区千種２－１６－１３イオン千種ＳＣ２Ｆ
prichan,愛知県,カラフルパークイオン有松,愛知県名古屋市緑区鳴海町字有松裏２００番地イオンタウン有松１Ｆ
prichan,愛知県,キッズインタイトーイオン春日井,愛知県春日井市　柏井町４丁目１７番地　イオン春日井店３Ｆゲームコーナー
prichan,愛知県,ゲームランド岡崎,愛知県岡崎市戸崎町字外山３８－５イオンモール岡崎シネマ館３Ｆ
prichan,愛知県,ジョーシン半田,愛知県半田市浜田町３－８－１
prichan,愛知県,セガｍｏｚｏワンダーシティ上小田井,愛知県名古屋市西区二方町４０番地「ｍｏｚｏワンダーシティ」４Ｆ
prichan,愛知県,セガイオンタウン刈谷,愛知県刈谷市東境町京和１
prichan,愛知県,セガイオンタウン名西,愛知県名古屋市西区香呑町六丁目４９－１
prichan,愛知県,セガイオンモール木曽川,愛知県一宮市木曽川町黒田八ヶ池２５－１　イオンモール木曽川３階
prichan,愛知県,セガプライムツリー赤池,愛知県日進市赤池町箕ノ手１番（３１３区画）（仮）
prichan,愛知県,セガワールド知立,愛知県知立市長篠町大山１８－１ギャラリエアピタ１階
prichan,愛知県,セガ安城,愛知県安城市百石町２丁目３５番地１３
prichan,愛知県,セガ春日井,愛知県春日井市岩野町菅廻間4180
prichan,愛知県,セガ東名ボール,愛知県瀬戸市西原町２丁目１１４
prichan,愛知県,セガ尾西,愛知県一宮市篭屋３－９－７アソビックスびさい１Ｆ
prichan,愛知県,ソユープレイランドソピア安城,愛知県安城市住吉町３－１－８イトーヨーカドー安城店２階
prichan,愛知県,ソユーブレーメンタウン鳴海,愛知県名古屋市緑区鳴海町字伝冶山３－９アピタ鳴海店２Ｆ
prichan,愛知県,タイトーステーションパールシティ稲沢,愛知県稲沢市井之口大坪町８０－１パールシティ２Ｆ
prichan,愛知県,タイトーステーションフェドラ大須,愛知県名古屋市中区大須３－３０－３１萬松寺駐車場ビル１階・２階
prichan,愛知県,タイトーステーション大須,愛知県名古屋市中区大須３－２０－７
prichan,愛知県,タイトーステーション豊橋,愛知県豊橋市藤沢町１４１－１　１Ｆ
prichan,愛知県,タイトーステーション弥富,愛知県弥富市五明蒲原１３７１－４
prichan,愛知県,トイザらス名古屋中川,愛知県名古屋市中川区新家１－２４２１　アズパーク２Ｆ
prichan,愛知県,ハローズガーデンワンダーフォレスト江南西,愛知県江南市松竹町上野２０５ＶＩＡＭＡＬＬアピタ江南西店２Ｆ
prichan,愛知県,ハローズガーデン安城南,愛知県安城市桜井町貝戸尻６０番地アピタ安城南店２階
prichan,愛知県,ハローズガーデン三河安城,愛知県安城市三河安城南町１－４－８ピアゴ三河安城店２Ｆ
prichan,愛知県,ピアゴラフーズコアアラタマ,愛知県名古屋市南区駈丘１－１－３１
prichan,愛知県,ピアゴ阿久比,愛知県知多郡阿久比町卯坂字惣山65番地
prichan,愛知県,ピアゴ印場,愛知県尾張旭市庄中町1-5-1
prichan,愛知県,ピアゴ吉良,愛知県幡豆郡吉良町吉田字天笠桂１６番地３　玩具売場
prichan,愛知県,ピアゴ幸田,愛知県額田郡幸田町大草山添170番地
prichan,愛知県,ピアゴ江南,愛知県江南市村久野町瀬頭163
prichan,愛知県,ピアゴ香久山,愛知県日進市香久山五丁目１８０１番地　玩具売場
prichan,愛知県,ピアゴ佐屋,愛知県愛西市北一色町東田面１０－１
prichan,愛知県,ピアゴ篠木,愛知県春日井下市場町3丁目6番地2
prichan,愛知県,ピアゴ守山,愛知県名古屋市守山区東山町12番26号
prichan,愛知県,ピアゴ十四山,愛知県弥富市鍋平長目47番地
prichan,愛知県,ピアゴ上和田,愛知県岡崎市上和田町字サジ１０　玩具売場
prichan,愛知県,ピアゴ植田,愛知県名古屋市天白区元植田１－３０２
prichan,愛知県,ピアゴ新城,愛知県新城市字的場２５番地の１１　玩具売場
prichan,愛知県,ピアゴ清水山,愛知県名古屋市緑区清水山1-501
prichan,愛知県,ピアゴ西城,愛知県名古屋市守山区村合町１７５番地
prichan,愛知県,ピアゴ大清水,愛知県豊橋市南大清水町字富士見700-1
prichan,愛知県,ピアゴ知立,愛知県知立市南新地1番地2-6
prichan,愛知県,ピアゴ中村,愛知県名古屋市中村区大門町２７番地　玩具売場
prichan,愛知県,ピアゴ東栄,愛知県安城市東栄町５丁目２０－１玩具売場
prichan,愛知県,ピアゴ東刈谷,愛知県刈谷市松栄町２丁目１４番地１７玩具売場
prichan,愛知県,ピアゴ洞,愛知県岡崎市洞町字的場72-2
prichan,愛知県,ピアゴ八剱,愛知県岩倉市八剱町長野１番地３
prichan,愛知県,ピアゴ尾西,愛知県一宮市小信中島東鵯平５９
prichan,愛知県,ピアゴ布袋,愛知県江南市布袋下山町西１９番地
prichan,愛知県,ピアゴ福釜,愛知県安城市福釜町矢場１６番地５　玩具売場
prichan,愛知県,ピアゴ平針,愛知県名古屋市天白区平針二丁目１２０１番地
prichan,愛知県,ピアゴ碧南,愛知県碧南市天王町2丁目1番地　玩具売場
prichan,愛知県,ピアゴ碧南東,愛知県碧南市東浦町６丁目１７番地　玩具売場
prichan,愛知県,ピアゴ妙興寺,愛知県一宮市大和田町妙興寺白山西３－２
prichan,愛知県,ピアゴ矢作,愛知県岡崎市舳越町字神道35番地
prichan,愛知県,ビックカメラＪＲゲートタワー,愛知県名古屋市中村区名駅１－１－３
prichan,愛知県,ビックカメラ名古屋駅西,愛知県名古屋市中村区椿町６－９
prichan,愛知県,ビックトイズプライムツリー赤池,愛知県日進市赤池町箕ノ手１番
prichan,愛知県,ファミリーアミューズメント新城,愛知県新城市宮ノ後６８ピアゴ新城店２Ｆ
prichan,愛知県,ファミリーランドドリーム,愛知県田原市田原町南新地７６－１
prichan,愛知県,ファンタジーウエストタウン西尾,愛知県西尾市高畠町３－２３－９ヴェルサウォーク西尾店３階
prichan,愛知県,プラサカプコン稲沢,愛知県稲沢市下津町地内尾張西部郡都市拠点地区１３街区リーフフォーク稲沢２０１区画
prichan,愛知県,プラサカプコン徳重,愛知県名古屋市緑区鳴海町字徳重１８番地４４ヒルズウォーク徳重ガーデンズガーデンズ棟２Ｆ
prichan,愛知県,プラサカプコン豊田,愛知県豊田市東山町１－５－１　グリーンシティ３Ｆ
prichan,愛知県,プリズムストーン  名古屋,愛知県名古屋市中村区椿町6-9 ビックカメラ 名古屋駅西店店内アニメガ×ソフマップ名古屋店
prichan,愛知県,モーリーファンタジー・ｆ新瑞橋,愛知県名古屋市南区菊住１丁目７－１０イオンモール３Ｆ
prichan,愛知県,モーリーファンタジーナゴヤドーム前,愛知県名古屋市東区矢田南４丁目１０２番地の３イオン３Ｆ
prichan,愛知県,モーリーファンタジーピアゴ大和,愛知県一宮市大和町毛受字一本松１９番地ピアゴ大和２Ｆ
prichan,愛知県,モーリーファンタジーメイトピア,愛知県名古屋市名東区高間町５０１－１ダイエーメイトピア店２Ｆ
prichan,愛知県,モーリーファンタジーワンダーシティ,愛知県名古屋市西区二方町４０イオン３Ｆ
prichan,愛知県,モーリーファンタジー岡崎,愛知県岡崎市上六名町字宮前１ショッピングセンターコムタウン１Ｆ
prichan,愛知県,モーリーファンタジー岡崎南,愛知県岡崎市戸崎町字ばら山１－１イオン３Ｆ
prichan,愛知県,モーリーファンタジー三好,愛知県みよし市三好町青木９１番地イオン２Ｆ
prichan,愛知県,モーリーファンタジー守山,愛知県名古屋市守山区笹ヶ根３－１２２８イオン2階
prichan,愛知県,モーリーファンタジー春日井,愛知県春日井市柏井町４－１７イオン4階
prichan,愛知県,モーリーファンタジー上飯田,愛知県名古屋市北区織部町１ダイエー上飯田店３Ｆ
prichan,愛知県,モーリーファンタジー常滑,愛知県常滑市りんくう町2丁目20番3　イオンスタイル2F
prichan,愛知県,モーリーファンタジー瀬戸みずの,愛知県瀬戸市みずの坂２丁目２５３番地　イオン２Ｆ
prichan,愛知県,モーリーファンタジー大高,愛知県名古屋市緑区大高町字奥平子１－１イオン３Ｆ
prichan,愛知県,モーリーファンタジー長久手,愛知県長久手市長久手中央イオン３Ｆ
prichan,愛知県,モーリーファンタジー東浦,愛知県知多郡東浦町大字緒川字申新田二区６７－８イオン１Ｆ
prichan,愛知県,モーリーファンタジー熱田,愛知県名古屋市熱田区六野一丁目２番１１号イオン２Ｆ
prichan,愛知県,モーリーファンタジー半田,愛知県半田市有楽町８－７イオン２Ｆ
prichan,愛知県,モーリーファンタジー扶桑,愛知県丹羽郡扶桑町大字南山名字高塚５－１イオン２Ｆ
prichan,愛知県,モーリーファンタジー豊橋南,愛知県豊橋市野依町字落合１－１２イオン２Ｆ
prichan,愛知県,モーリーファンタジー豊川,愛知県豊川市開運通り２－３１　イオン２Ｆ
prichan,愛知県,モーリーファンタジー豊田,愛知県豊田市広路１－１イオンスタイル豊田内３Ｆ
prichan,愛知県,モーリーファンタジー妙興寺,愛知県一宮市大和町妙興寺字白山西３番地２ピアゴ妙興寺店3階
prichan,愛知県,モーリーファンタジー名古屋みなと,愛知県名古屋市港区品川町２－１－６イオン３Ｆ
prichan,愛知県,モーリーファンタジー名古屋茶屋,愛知県名古屋市港区西茶屋２丁目１１イオン３Ｆ
prichan,愛知県,モーリーファンタジー名古屋東,愛知県名古屋市名東区猪子石原２－１７０１イオン１Ｆ
prichan,愛知県,モーリーファンタジー木曽川,愛知県一宮市木曽川町黒田字南八ツヶ池２５－１イオン２Ｆ
prichan,愛知県,ヤマダ電機ＬＡＢＩ名古屋,愛知県名古屋市中村区名駅１－２－５
prichan,愛知県,ユーズランド東浦,愛知県知多郡東浦町緒川申新田二区６７－８イオンモール東浦２Ｆ
prichan,愛知県,ヨドバシカメラマルチメディア名古屋松坂屋,愛知県小牧市入鹿出新田８２２
prichan,愛知県,らんらんらんど名古屋東,愛知県名古屋市名東区猪子石原２－１７０１ダイエー名古屋東店１Ｆ
prichan,愛知県,ワンダーフォレスト江南西,愛知県江南市松竹町上野２０５ＶＩＡＭＡＬＬアピタ江南西店２Ｆ
prichan,愛知県,安城メトロポリス,愛知県安城市浜富町６－８
prichan,愛知県,楽市楽座イオンモール名古屋茶屋,愛知県名古屋市港区西茶屋２丁目１１イオンモール名古屋茶屋店３階
prichan,愛知県,中川メトロポリス,愛知県名古屋市中川区江松三丁目１１０番地
prichan,愛知県,平和堂江南,愛知県江南市上奈良町栄６１－３　玩具売場
prichan,愛知県,豊川メトロポリス,愛知県豊川市下長山町上アライ１４－１
