series,prefecture,name,address
prichan,三重県,ＭＥＧＡドン・キホーテＵＮＹ星川,三重県桑名市大字星川 十二８３５
prichan,三重県,ＭＥＧＡドン・キホーテＵＮＹ名張,三重県名張市下比奈知黒田3100番地の1
prichan,三重県,ＮＩＣＯＰＡイオン伊勢店,三重県伊勢市楠部町乙１６０　イオン伊勢店
prichan,三重県,ＮＩＣＯＰＡイオン津店,三重県津市桜橋３－４４６　イオン津店　２Ｆ
prichan,三重県,アミューズメントパークさくら芸濃,三重県津市芸濃町椋本字 一ツ谷３０８３イオンタウン芸濃店内ゲームコーナー
prichan,三重県,ＮＩＣＯＰＡ四日市北,三重県四日市市富州原町２－４0イオン四日市北内
prichan,三重県,ＮＯＳＩＣＡ桑名,三重県桑名市新西方１丁目２２番地イオンモール桑名２番街２階
prichan,三重県,ＰＡＬＯ桑名,三重県桑名市新西方１丁目２２番地
prichan,三重県,ＹＡＺワールド四日市,三重県四日市市泊小柳４－３－４
prichan,三重県,アピタ伊賀上野,三重県上野市服部町１７８８番地　玩具売場
prichan,三重県,アピタ桑名,三重県桑名市中央町３－２１
prichan,三重県,アピタ四日市,三重県四日市市安島１丁目３番３１号　玩具売場
prichan,三重県,アピタ松阪三雲,三重県松阪市市場庄町１２６６番地の１玩具売場
prichan,三重県,アピナ鈴鹿,三重県鈴鹿市庄野羽山４－２０－１イオンタウン鈴鹿２階
prichan,三重県,イオン伊勢,三重県伊勢市楠部町乙１６０－２玩具売場
prichan,三重県,イオン四日市尾平,三重県四日市市尾平町字天王川原１８０５玩具売場
prichan,三重県,イオン四日市北,三重県四日市市富州原町２－４０
prichan,三重県,イオン白子,三重県鈴鹿市白子駅前９－２０
prichan,三重県,イオン明和,三重県多気郡明和町中村１２２３玩具売場
prichan,三重県,イオン鈴鹿,三重県鈴鹿市庄野羽山４－１－２玩具売場
prichan,三重県,クラブセガアドバンスモール松阪,三重県松阪市田村町２３５－１
prichan,三重県,セガワールド久居,三重県津市久居明神町字風早２５３４－１
prichan,三重県,ドナリアコットサンズ,三重県鈴鹿市白子駅前９－２０サンズ店内３Ｆ
prichan,三重県,ハローズガーデン鈴鹿,三重県鈴鹿市南玉垣町３６２８アピタ鈴鹿店２Ｆ
prichan,三重県,ハローズスーパセンターオークワいなべ,三重県いなべ市大安町石榑東１９２８－１スーパーセンターオークワいなべ店
prichan,三重県,ピアゴ阿倉川,三重県四日市市阿倉川町１５番２７号　玩具売場
prichan,三重県,ピアゴ嬉野,三重県松阪市嬉野中川新町４丁目２０５番地　玩具売場
prichan,三重県,ピアゴ菰野,三重県三重郡菰野町竹成３９９８－７
prichan,三重県,ピアゴ東員,三重県員弁郡東員町六杷野新田字村西７８５番地６
prichan,三重県,プレビララスクエア四日市,三重県四日市市安島１－３－３１ララスクエア５Ｆ
prichan,三重県,モーリーファンタジーイオン鈴鹿,三重県鈴鹿市庄野羽山４－１－２イオン２Ｆ
prichan,三重県,モーリーファンタジー阿児,三重県志摩市阿児町鵜方３２１５イオン２Ｆ
prichan,三重県,モーリーファンタジー伊賀上野,三重県伊賀市上野茅町２５１９イオン２Ｆ
prichan,三重県,モーリーファンタジー伊勢ララパーク,三重県伊勢市小木町曽弥５３８イオンタウン伊勢ララパーク２Ｆ
prichan,三重県,モーリーファンタジー桑名,三重県桑名市新西方１丁目２２番地イオン桑名ＳＣ１番街３階
prichan,三重県,モーリーファンタジー四日市尾平,三重県四日市市尾平町字天王川原１８０５イオン３Ｆ
prichan,三重県,モーリーファンタジー四日市北,三重県四日市市富州原町２－４０イオン２Ｆ
prichan,三重県,モーリーファンタジー松阪,三重県松阪市船江町１３９２－２７まーむ３Ｆ
prichan,三重県,モーリーファンタジー津城山,三重県津市久居小野辺町１１３０－７イオンタウン２Ｆ
prichan,三重県,モーリーファンタジー東員,三重県員弁郡東員町長深字築田５１０番地１イオン３Ｆ
prichan,三重県,モーリーファンタジー明和,三重県多気郡明和町中村長波賀１２２３番地イオン２Ｆ
prichan,三重県,モーリーファンタジー鈴鹿,三重県鈴鹿市算所２－５－１
prichan,三重県,仔熊近鉄百貨店四日市,三重県四日市市諏訪栄町７－３４近鉄百貨店四日市店６階玩具売り場
prichan,三重県,四日市アミューズメントパーク,三重県四日市市安島１－３－３１ララスクエア５Ｆ
