series,prefecture,name,address
pripara,千葉県,タイトーステーション船橋,千葉県船橋市本町１丁目６－１
pripara,千葉県,キラキラＡｓｏｂｏｘフルル八千代,千葉県八千代市村上南１－４－１フルルガーデン八千代２Ｆ
pripara,千葉県,タイトーステーション茂原アスモ,千葉県茂原市高師１７３５茂原ショッピングプラザ アスモ２F
pripara,千葉県,ＧＡＭＥＳＱＵＡＲＥ茂原,千葉県茂原市六ツ野八貫野２７８５－１　ライフガーデン茂原
pripara,千葉県,アミュージアム茂原,千葉県茂原市高師１６１９－１
pripara,千葉県,ＭＥＧＡドン・キホーテ八千代１６号バイパス,千葉県八千代市村上１２４５
pripara,千葉県,ＮＩＣＯＰＡ＆ｎｉｃｏｇｒｏｕｎｄ新浦安,千葉県浦安市明海４－１－１ニューコースト新浦安３Ｆ
pripara,千葉県,ＰＡＬＯ市川,千葉県市川市鬼高１－１－１ニッケコルトンプラザ2階
pripara,千葉県,ＰＡＬＯ柏,千葉県柏市 豊町２－５－２５ イオン３Ｆ
pripara,千葉県,ＹＡＺワールド野田七光台,千葉県野田市七光台４－２
pripara,千葉県,アピタ木更津,千葉県木更津市ほたるの４－２－４８　玩具売場
pripara,千葉県,アピナ市原,千葉県市原市更級４－２－１アクロスプラザ市原更級Ｆ棟１階
pripara,千葉県,アミュージアム稲毛,千葉県千葉市稲毛区小仲台１－４－２０イオン稲毛２Ｆ
pripara,千葉県,イオン幕張,千葉県千葉市美浜区ひび野１－３
pripara,千葉県,イオン旭,千葉県旭市イ－２６７６玩具売場
pripara,千葉県,イオン臼井,千葉県佐倉市王子台１－２３玩具売場
pripara,千葉県,イオン成田,千葉県成田市ウイング土屋２４番地　イオン２Ｆ玩具売場
pripara,千葉県,イオン千葉ニュータウン,千葉県印西市中央北３－１－１玩具売場
pripara,千葉県,イトーヨーカドーアリオ市原,千葉県市原市更級四丁目３番２玩具売場
pripara,千葉県,イトーヨーカドーアリオ蘇我,千葉県千葉市中央区川崎町５２－７玩具売場
pripara,千葉県,イトーヨーカドー我孫子,千葉県我孫子市我孫子４－１１－１玩具売場
pripara,千葉県,イトーヨーカドー四街道,千葉県四街道市四街道都市核北土地区画整理事業地内５街区玩具売場
pripara,千葉県,イトーヨーカドー松戸,千葉県松戸市松戸１１４９玩具売場
pripara,千葉県,イトーヨーカドー八千代,千葉県八千代市村上４００１－４玩具売場
pripara,千葉県,イトーヨーカドー幕張,千葉県千葉市花見川区幕張町４－４１７－２５玩具売場
pripara,千葉県,ゲームフジ市川,千葉県市川市市川１－１９－１１
pripara,千葉県,ゲームランド津田沼,千葉県習志野市津田沼１－２３－１イオンモール津田沼２Ｆ
pripara,千葉県,ゲームランド千葉ニュータウン,千葉県印西市中央北３－３　イオンモール千葉ニュータウン　シネマスポーツ棟２Ｆ
pripara,千葉県,スコナランド酒々井,千葉県印旛郡酒々井町本佐倉４５７－２
pripara,千葉県,そごう千葉,千葉県千葉市中央区新町１０００そごう　千葉店　本館　６Ｆ玩具売場
pripara,千葉県,タイトーステーション旭サンモール,千葉県旭市イ－２６７６－１　サンモール３Ｆ
pripara,千葉県,トイザらス成田,千葉県成田市飯仲９－４
pripara,千葉県,トイザらス千葉長沼,千葉県千葉市稲毛区長沼町３３０－５０
pripara,千葉県,にこぱアクロスモール新鎌ヶ谷,千葉県鎌ヶ谷市初富９２８番地　アクロスモール新鎌ヶ谷２Ｆ
pripara,千葉県,ニコパマリンピア,千葉県千葉市美浜区高洲３－１３－１　　マリンピア４階
pripara,千葉県,パラボランド東金,千葉県東金市東岩崎８－１０サンピア３Ｆ
pripara,千葉県,パレパレ稲毛長沼,千葉県千葉市稲毛区長沼原町７３１－１７
pripara,千葉県,ハローズガーデン市原,千葉県市原市青柳北１－１アピタ市原店２階
pripara,千葉県,ハローズガーデン木更津,千葉県木更津市ほたる野４－２－４８アピタ木更津店２Ｆ
pripara,千葉県,ビックカメラ柏店,千葉県柏市柏市１－１－２０スカイプラザ柏玩具売り場
pripara,千葉県,プラサカプコンちはら台,千葉県市原市ちはら台西３－４　ショッピングモールｕｎｉｍｏちはら台２Ｆ
pripara,千葉県,プラサカプコン成田,千葉県成田市ウイング土屋２４　イオンモール成田２Ｆ
pripara,千葉県,プラサカプコン富津,千葉県富津市青木一丁目５番地１　イオンモール富津２Ｆ
pripara,千葉県,モーリーファンタジーあすみが丘,千葉県千葉市緑区あすみが丘７丁目１番あすみが丘ブランニューモール2階
pripara,千葉県,モーリーファンタジーおゆみ野,千葉県千葉市緑区おゆみ野南５丁目３７－１イオンタウン２Ｆ
pripara,千葉県,モーリーファンタジーノア,千葉県野田市中根３６－１イオン１Ｆ
pripara,千葉県,モーリーファンタジーユーカリが丘,千葉県佐倉市西ユーカリが丘６－１２－３イオンタウン3階
pripara,千葉県,モーリーファンタジー鎌ヶ谷,千葉県鎌ヶ谷市新鎌ヶ谷２丁目７番１号　イオン２Ｆ（玩具売場）
pripara,千葉県,モーリーファンタジー鎌取,千葉県千葉市緑区おゆみ野３丁目１６番地　イオン３Ｆ
pripara,千葉県,モーリーファンタジー館山,千葉県館山市八幡５４５－１イオン１Ｆ
pripara,千葉県,モーリーファンタジー市川妙典,千葉県市川市妙典５－３－１　　イオン３Ｆ
pripara,千葉県,モーリーファンタジー成田,千葉県成田市ウイング土屋２４番地イオン2階
pripara,千葉県,モーリーファンタジー船橋,千葉県船橋市山手１丁目１番地８号イオン３Ｆ
pripara,千葉県,モーリーファンタジー銚子,千葉県銚子市三崎町２丁目２６６０－１イオン２Ｆ
pripara,千葉県,モーリーファンタジー長浦,千葉県袖ヶ浦市長浦駅前１－７
pripara,千葉県,モーリーファンタジー津田沼,千葉県習志野市津田沼１丁目２３番１号イオン３Ｆ
pripara,千葉県,モーリーファンタジー東習志野,千葉県習志野市東習志野６丁目７－８　イオンタウン１Ｆ
pripara,千葉県,モーリーファンタジー南行徳,千葉県市川市南行徳２－２０－２５
pripara,千葉県,モーリーファンタジー柏,千葉県柏市豊町２丁目５番２５号イオン２Ｆ
pripara,千葉県,モーリーファンタジー八街,千葉県八街市文違３０１イオン１Ｆ
pripara,千葉県,モーリーファンタジー八千代緑が丘,千葉県八千代市緑が丘２丁目１－３イオン４Ｆ
pripara,千葉県,モーリーファンタジー木更津,千葉県木更津市築地１－４　イオン２Ｆ
pripara,千葉県,ヤマダ電機ＬＡＢＩ津田沼,千葉県習志野市谷津１－１６－１モリシア津田沼３Ｆ　玩具売場
pripara,千葉県,ヨドバシカメラマルチメディア千葉,千葉県千葉市中央区富士見２－３－１　玩具売場
pripara,千葉県,西友常盤平,千葉県松戸市常盤平３－１１－１玩具売場
pripara,千葉県,鉄腕２４稲毛長沼,千葉県千葉市稲毛区長沼原町６９７
pripara,千葉県,宝島四街道,千葉県四街道市めいわ２－１－１ＭＥＧＡドン・キホーテ２Ｆ
pripara,千葉県,宝島ららぽーと柏の葉,千葉県柏市若柴175ららぽーと柏の葉3F
pripara,千葉県,宝島新浦安,千葉県浦安市入船１－４－１イオン新浦安店４Ｆ
