series,prefecture,name,address
pripara,兵庫県,モーリーファンタジー宝塚中山,兵庫県宝塚市売布東の町２１－２２ダイエー２階
pripara,兵庫県,ふぇすたらんど土山,兵庫県明石市魚住町清水字舞々２２０８－１ イオン土山店内
pripara,兵庫県,モーリーファンタジー藤原台,兵庫県神戸市北区藤原台中町１－２－２
pripara,兵庫県,ホムスタ玉津,兵庫県神戸市西区丸塚２－９－１８ メガパレス２Ｆ
pripara,兵庫県,タイトーＦステーション三宮西館,兵庫県神戸市中央区三宮町２－１１－１ 三宮センタービル西館３階
pripara,兵庫県,モーリーファンタジー伊丹,兵庫県伊丹市藤ノ木１－１－１イオン３階
pripara,兵庫県,モーリーファンタジー和田山,兵庫県朝来市和田山町枚田岡７７４イオン２階
pripara,兵庫県,ふぇすたらんど小野店,兵庫県小野市王子町８６８－１ イオン小野店２Ｆ
pripara,兵庫県,ホムスタ加古川,兵庫県加古川市尾上町安田３５１番メガコート２Ｆ
pripara,兵庫県,モーリーファンタジージェームス山,兵庫県神戸市垂水区青山台７－７－１ イオン１階
pripara,兵庫県,プリズムストーン三宮店,兵庫県神戸市中央区三宮町１丁目９－１－２０１－２ センタープラザ２Ｆ
pripara,兵庫県,モーリーファンタジー板宿,兵庫県神戸市須磨区前池町３－２－１ダイエー板宿店４Ｆ
pripara,兵庫県,モーリーファンタジー三木青山,兵庫県三木市志染町青山３－９ イオン２階
pripara,兵庫県,モーリーファンタジー長田南,兵庫県神戸市長田区東尻池新町１番２０号イオンＳＣ２階
pripara,兵庫県,モーリーファンタジー洲本,兵庫県洲本市塩屋１－１－８イオン２Ｆ
pripara,兵庫県,モーリーファンタジー舞子,兵庫県神戸市垂水区舞子台６－２０－１７ダイエー２階
pripara,兵庫県,モーリーファンタジー高砂,兵庫県高砂市緑丘２丁目１－４０ イオン２Ｆ
pripara,兵庫県,モーリーファンタジー社,兵庫県加東市社１１２６－１イオン２Ｆ
pripara,兵庫県,アミパラ加古川,兵庫県加古川市尾上町今福７１－２
pripara,兵庫県,モーリーファンタジー姫路大津,兵庫県姫路市大津区大津町２－５イオンモール姫路大津イオン姫路大津２Ｆ
pripara,兵庫県,アピナ姫路,兵庫県姫路市東郷町１４５４－３姫路リオス２Ｆ
pripara,兵庫県,わいわいカーニバル,兵庫県神戸市北区日の峰２－６－１コアキタマチ３Ｆ
pripara,兵庫県,モーリーファンタジー明石,兵庫県明石市大久保町ゆりのき通り３－３－１
pripara,兵庫県,イオン伊丹昆陽,兵庫県伊丹市池尻４－１－１  イオン３Ｆ玩具売場
pripara,兵庫県,モーリーファンタジー南淡路,兵庫県南あわじ市賀集八幡北字東内３７８－１ イオン１階
pripara,兵庫県,ニシダヤ三和,兵庫県尼崎市神田南通３－８３
pripara,兵庫県,モーリーファンタジー竜野,兵庫県たつの市龍野町堂本字五反田２５０－１ イオン３階
pripara,兵庫県,ハローズガーデン広畑,兵庫県姫路市広畑区夢前町１－１－１ＭＥＧＡドンキホーテ姫路広畑店１階
pripara,兵庫県,モーリーファンタジー三木,兵庫県三木市大村字砂１６３ イオン３Ｆ
pripara,兵庫県,セガあまがさきキューズモール,兵庫県尼崎市潮江１－３－１ ココエあまがさき４Ｆ
pripara,兵庫県,モーリーファンタジー尼崎,兵庫県尼崎市次屋３－１３－１８イオン２階
pripara,兵庫県,モーリーファンタジーｆ加西北条,兵庫県加西市北条町北条３０８－１イオン２Ｆ
pripara,兵庫県,セガつかしん,兵庫県尼崎市塚口本町４－８－１ つかしん内
pripara,兵庫県,モーリーファンタジー神戸北,兵庫県神戸市北区上津台８－１－１ イオン３Ｆ
pripara,兵庫県,モーリーファンタジー姫路リバーシティ,兵庫県姫路市飾麿区細江２５６０ イオン姫路リバーシティ２Ｆ
pripara,兵庫県,モーリーファンタジー西神中央,兵庫県神戸市西区糀台５－３－４
pripara,兵庫県,モーリーファンタジー名谷,兵庫県神戸市須磨区中落合２丁目２－２ ダイエー名谷２階
pripara,兵庫県,モーリーファンタジー猪名川,兵庫県川辺郡猪名川町白金２－１イオン３Ｆ
pripara,兵庫県,モーリーファンタジー西宮,兵庫県西宮市林田町２－２４ イオン２階
pripara,兵庫県,モーリーファンタジー山崎,兵庫県宍粟市山崎町中井字城下１０ イオン３階
pripara,兵庫県,タイトーステーション尼崎つかしん,兵庫県尼崎市塚口本町４－８－１ ＳＣつかしん内東町北館３Ｆ
pripara,兵庫県,タイトーＦステーション姫路店,兵庫県姫路市駅前町２６９．２７０番地
pripara,兵庫県,タイトーＦステーションＨＡＴ神戸,兵庫県神戸市中央区脇浜海岸通２－２－２ ブルメールＨＡＴ神戸２Ｆ
pripara,兵庫県,エディオン垂水,兵庫県神戸市垂水区舞多聞東２丁目１－４５
pripara,兵庫県,エディオン神戸北町,兵庫県神戸市北区日の峰２－３－３
